{
  "tender_metadata": {
    "analysis_id": "ANALYSIS_1790419184",
    "document_title": "sample_tender.pdf",
    "file_name": "sample_tender.pdf",
    "file_hash_sha256": "b59f9166a22732df2ae67f91bce73260feaa5f3b09767741e1b06c2e37ff22f2",
    "page_count": 3,
    "analyzed_at": "2026-09-26T10:39:44.463248+00:00",
    "procuring_department": null
  },
  "extracted_requirements": [
    {
      "requirement_id": "REQ_001",
      "field": "Commercial / Supply",
      "category": "QUANTITY",
      "parameter_name": "Procurement Quantity",
      "value": "150 units",
      "unit": "units",
      "normalized_value": {
        "numeric_value": 150.0,
        "min_value": 150.0,
        "max_value": 150.0,
        "unit": "units",
        "operator": "EQUAL",
        "text_value": "150.0 units"
      },
      "product_category_context": "Openwell Submersible Pumpsets",
      "is_mandatory": true,
      "source_text": "1.1 The contractor shall manufacture, inspect, test, pack, and deliver 150 units of Openwell Submersible Pumpsets\nsuitable for direct submerged operation in village open intake wells and masonry community sumps.",
      "source_location": {
        "source_page": 1,
        "clause_number": "1.1",
        "line_number": null,
        "table_identifier": null,
        "char_start": 559,
        "char_end": 941,
        "bounding_box": null
      },
      "extraction_confidence": 0.95,
      "notes": "Deterministic regex extraction (QUANTITY)."
    },
    {
      "requirement_id": "REQ_002",
      "field": "General Specification",
      "category": "OTHER_TECHNICAL_PARAMETER",
      "parameter_name": "Other_Technical_Parameter Requirement",
      "value": "1.2 The equipment shall comprise a multi-stage centrifugal pump directly coupled to a water-filled, continuous-duty\nsubm...",
      "unit": null,
      "normalized_value": {
        "numeric_value": null,
        "min_value": null,
        "max_value": null,
        "unit": null,
        "operator": "TEXT_EXACT",
        "text_value": "1.2 The equipment shall comprise a multi-stage centrifugal pump directly coupled to a water-filled, continuous-duty\nsubmersible electric motor."
      },
      "product_category_context": "Openwell Submersible Pumpsets",
      "is_mandatory": true,
      "source_text": "1.2 The equipment shall comprise a multi-stage centrifugal pump directly coupled to a water-filled, continuous-duty\nsubmersible electric motor.",
      "source_location": {
        "source_page": 1,
        "clause_number": "1.2",
        "line_number": null,
        "table_identifier": null,
        "char_start": 559,
        "char_end": 941,
        "bounding_box": null
      },
      "extraction_confidence": 0.88,
      "notes": "Qualitative specification clause."
    },
    {
      "requirement_id": "REQ_003",
      "field": "Environmental",
      "category": "OPERATING_ENVIRONMENT",
      "parameter_name": "Operating_Environment Requirement",
      "value": "2.1 Liquid Pumped: Clear, cold drinking water, non-aggressive, free from abrasive solids.",
      "unit": null,
      "normalized_value": {
        "numeric_value": null,
        "min_value": null,
        "max_value": null,
        "unit": null,
        "operator": "TEXT_EXACT",
        "text_value": "2.1 Liquid Pumped: Clear, cold drinking water, non-aggressive, free from abrasive solids."
      },
      "product_category_context": "Openwell Submersible Pumpsets",
      "is_mandatory": false,
      "source_text": "2.1 Liquid Pumped: Clear, cold drinking water, non-aggressive, free from abrasive solids.",
      "source_location": {
        "source_page": 1,
        "clause_number": "2.1",
        "line_number": null,
        "table_identifier": null,
        "char_start": 943,
        "char_end": 1348,
        "bounding_box": null
      },
      "extraction_confidence": 0.88,
      "notes": "Qualitative specification clause."
    },
    {
      "requirement_id": "REQ_004",
      "field": "Operating Environment",
      "category": "TEMPERATURE",
      "parameter_name": "Maximum Water Temperature",
      "value": "33\u00b0C",
      "unit": "deg C",
      "normalized_value": {
        "numeric_value": 33.0,
        "min_value": null,
        "max_value": 33.0,
        "unit": "deg C",
        "operator": "LTE",
        "text_value": "<=33.0 deg C"
      },
      "product_category_context": "Openwell Submersible Pumpsets",
      "is_mandatory": true,
      "source_text": "2.2 Water Temperature: Ambient, not exceeding 33\u00b0C.",
      "source_location": {
        "source_page": 1,
        "clause_number": "2.2",
        "line_number": null,
        "table_identifier": null,
        "char_start": 943,
        "char_end": 1348,
        "bounding_box": null
      },
      "extraction_confidence": 0.95,
      "notes": "Deterministic regex extraction (TEMPERATURE)."
    },
    {
      "requirement_id": "REQ_005",
      "field": "Mechanical / Hydraulic",
      "category": "HEAD",
      "parameter_name": "Maximum Submergence Depth",
      "value": "15 meters ",
      "unit": "m",
      "normalized_value": {
        "numeric_value": 15.0,
        "min_value": null,
        "max_value": 15.0,
        "unit": "m",
        "operator": "LTE",
        "text_value": "<=15.0 m"
      },
      "product_category_context": "Openwell Submersible Pumpsets",
      "is_mandatory": true,
      "source_text": "2.3 Installation Depth: Fully submerged up to a maximum water submergence depth of 15 meters below lowest water\nlevel.",
      "source_location": {
        "source_page": 1,
        "clause_number": "2.3",
        "line_number": null,
        "table_identifier": null,
        "char_start": 943,
        "char_end": 1348,
        "bounding_box": null
      },
      "extraction_confidence": 0.95,
      "notes": "Deterministic regex extraction (HEAD)."
    },
    {
      "requirement_id": "REQ_006",
      "field": "Environmental",
      "category": "OPERATING_ENVIRONMENT",
      "parameter_name": "Operating_Environment Requirement",
      "value": "2.4 Operating Environment: Open rural agricultural wells subject to seasonal water table drawdown.",
      "unit": null,
      "normalized_value": {
        "numeric_value": null,
        "min_value": null,
        "max_value": null,
        "unit": null,
        "operator": "TEXT_EXACT",
        "text_value": "2.4 Operating Environment: Open rural agricultural wells subject to seasonal water table drawdown."
      },
      "product_category_context": "Openwell Submersible Pumpsets",
      "is_mandatory": false,
      "source_text": "2.4 Operating Environment: Open rural agricultural wells subject to seasonal water table drawdown.",
      "source_location": {
        "source_page": 1,
        "clause_number": "2.4",
        "line_number": null,
        "table_identifier": null,
        "char_start": 943,
        "char_end": 1348,
        "bounding_box": null
      },
      "extraction_confidence": 0.88,
      "notes": "Qualitative specification clause."
    },
    {
      "requirement_id": "REQ_007",
      "field": "Electrical",
      "category": "POWER",
      "parameter_name": "Rated Power Output",
      "value": "7.5 kW (10.0 HP)",
      "unit": "kW",
      "normalized_value": {
        "numeric_value": 7.5,
        "min_value": 7.5,
        "max_value": 7.5,
        "unit": "kW",
        "operator": "EQUAL",
        "text_value": "7.5 kW"
      },
      "product_category_context": "Openwell Submersible Pumpsets",
      "is_mandatory": false,
      "source_text": "3.1 Power Rating: 7.5 kW (10.0 HP) continuous rated output.",
      "source_location": {
        "source_page": 2,
        "clause_number": "3.1",
        "line_number": null,
        "table_identifier": null,
        "char_start": 0,
        "char_end": 394,
        "bounding_box": null
      },
      "extraction_confidence": 0.95,
      "notes": "Dual-unit specification: 7.5 kW primary (alternate: 10.0 HP)."
    },
    {
      "requirement_id": "REQ_008",
      "field": "Electrical",
      "category": "VOLTAGE",
      "parameter_name": "Rated Supply Voltage",
      "value": "415 V",
      "unit": "V",
      "normalized_value": {
        "numeric_value": 415.0,
        "min_value": 415.0,
        "max_value": 415.0,
        "unit": "V",
        "operator": "EQUAL",
        "text_value": "415.0 V"
      },
      "product_category_context": "Openwell Submersible Pumpsets",
      "is_mandatory": false,
      "source_text": "3.2 Supply Voltage: 415 V, 3-Phase, 50 Hz A.C. supply.",
      "source_location": {
        "source_page": 2,
        "clause_number": "3.2",
        "line_number": null,
        "table_identifier": null,
        "char_start": 0,
        "char_end": 394,
        "bounding_box": null
      },
      "extraction_confidence": 0.95,
      "notes": "Deterministic regex extraction (VOLTAGE)."
    },
    {
      "requirement_id": "REQ_009",
      "field": "Electrical",
      "category": "FREQUENCY",
      "parameter_name": "Rated Supply Frequency",
      "value": "50 Hz",
      "unit": "Hz",
      "normalized_value": {
        "numeric_value": 50.0,
        "min_value": 50.0,
        "max_value": 50.0,
        "unit": "Hz",
        "operator": "EQUAL",
        "text_value": "50.0 Hz"
      },
      "product_category_context": "Openwell Submersible Pumpsets",
      "is_mandatory": false,
      "source_text": "3.2 Supply Voltage: 415 V, 3-Phase, 50 Hz A.C. supply.",
      "source_location": {
        "source_page": 2,
        "clause_number": "3.2",
        "line_number": null,
        "table_identifier": null,
        "char_start": 0,
        "char_end": 394,
        "bounding_box": null
      },
      "extraction_confidence": 0.95,
      "notes": "Deterministic regex extraction (FREQUENCY)."
    },
    {
      "requirement_id": "REQ_010",
      "field": "Electrical",
      "category": "VOLTAGE",
      "parameter_name": "Permissible Voltage Variation Band",
      "value": "350V to 440V",